{"$schema":"https://json-schema.org/draft/2020-12/schema","type":"object","required":["id","label","space","subspace","low","high","description"],"properties":{"id":{"type":"string"},"label":{"type":"string"},"space":{"enum":["analytic","normative"]},"subspace":{"type":"string"},"low":{"type":"string"},"high":{"type":"string"},"description":{"type":"string"}},"additionalProperties":false}
